Service,Description,Details
VPC (Virtual Private Cloud),"Your VPCs, Subnets, Route Tables, Internet Gateways, NAT Gateways, Elastic IPs, DHCP option sets, Peering connections",Provides logically isolated section of AWS cloud | Allows launching resources in a virtual network you define | Improves security with NACLs and Security Groups | Supports PrivateLink and AWS VPC Lattice for service-to-service communication
Security & Networking,"Network ACLs, Security Groups, PrivateLink, Lattice, Endpoint services, Service networks, Target groups, DNS firewall, Rule groups, Domain lists",Protects resources at subnet (NACL) and instance level (Security Group) | Enables private connectivity to services using PrivateLink | Supports DNS Firewall to block malicious domains | Helps in organizing resources using Service Networks and Target groups
Network Firewall,"Firewall policies, Rule groups, TLS inspection configurations, Endpoint associations",Provides managed network firewall to protect workloads | Supports deep packet inspection with TLS configurations | Centralized management of firewall rules and policies | Associates with VPC endpoints for traffic monitoring
VPN & Verified Access,"Customer gateways, Virtual private gateways, Site-to-Site VPN, Client VPN, Verified Access instances, trust providers, groups, endpoints",Extends on-premises network securely into AWS | Site-to-Site VPN for corporate network integration | Client VPN for remote workforce secure access | Verified Access improves zero-trust security model
Transit Gateway & Traffic Mirroring,"Transit gateways, attachments, route tables, multicast, Traffic Mirroring (sessions, targets, filters)",Central hub for connecting multiple VPCs and on-premises networks | Improves routing efficiency and reduces complexity | Supports multicast traffic distribution across networks | Traffic Mirroring allows packet-level inspection for monitoring and security analysis
